{"artifact_kind":"master_en","candidate":{"bytes":75650,"path":"outputs/10-master-en-candidate/artifacts/MASTER_EN.md","sha256":"C3B4F13E3E43B2422704F1A7BCF61A5CF1762191B474FAAE5C4C4243289367AA"},"decision":"accepted","decision_at_utc":"2026-09-19T10:36:59.950213Z","evidence":[{"bytes":550,"path":"outputs/10-master-en-candidate/evidence/MASTER_EN.qa.json","sha256":"1BC6A11A8D0F6723DBABA78B58B6E168ABE3F78464193B75A34352000CD63829"},{"bytes":577,"path":"outputs/10-master-en-candidate/evidence/MASTER_EN.verification.json","sha256":"DEB9EA8786131F0C96AD9B8B4E41F0BF9B702DACD8EC07EBC54870C6C7CAF2B0"}],"producer_stage":{"bytes":26543,"path":"evidence/stages/10-master-en-candidate.manifest.json","sha256":"B8E227D5EC26EDF597CD0DD2ED0BA7450B511B5BA21D0071F3135E0655F3697C"},"receipt_sha256":"86AA0D72E00CFF309B187FD0E835602B3F445880D2EFDFDF907E6A539F5891C0","recorder_role":"main_orchestrator","scenario_id":"number-7-dream","schema":"kb_creator.artifact_acceptance.v1","user_decision_reference":"Previously accepted MASTER_EN; run30 exact SHA-256 C3B4F13E3E43B2422704F1A7BCF61A5CF1762191B474FAAE5C4C4243289367AA unchanged"}
