{"artifact_kind":"pdf","candidate":{"bytes":2914792,"path":"outputs/60-pdf-candidate/artifacts/Number_7_Dream_RU.pdf","sha256":"9D9E617D263AF3F81A772E575A394E362A46429ED248D77745A9B7618B5D7875"},"decision":"accepted","decision_at_utc":"2026-09-19T11:14:58.433706Z","evidence":[{"bytes":1167,"path":"outputs/60-pdf-candidate/evidence/docx_pdf_export.json","sha256":"BFC9970E98371B6CD9F522A6BA5C54EC60C078E5650E808B4E39D7A496A61D62"},{"bytes":8231,"path":"outputs/60-pdf-candidate/evidence/final_render/render_inventory.json","sha256":"2EDB99F7F8831053DBF6B3E5D2A9AED4D4A32FEFC6BBF3FC22507F467C60AE62"}],"producer_stage":{"bytes":7610,"path":"evidence/stages/60-pdf-candidate.manifest.json","sha256":"AE2E478BE4B712811EE6B46C9891287AAE02F038CB8F16204D6DF7E6011308B9"},"receipt_sha256":"18051EB9D546D4ECBFF5824E25CC1797144E925BE19EA19B8F64CFDC36EDCF85","recorder_role":"main_orchestrator","scenario_id":"number-7-dream","schema":"kb_creator.artifact_acceptance.v1","user_decision_reference":"2026-09-19 user directed assemble artifact package immediately after explicit confirmation request for run30 PDF; exact PDF SHA-256 9D9E617D263AF3F81A772E575A394E362A46429ED248D77745A9B7618B5D7875"}
