{"artifact_kind":"html","candidate":{"bytes":153683,"path":"outputs/40-html-candidate/artifacts/Number_7_Dream_RU.html","sha256":"774F22BC2D1FF55BBCEF22ED5BC8539508F265A01D34E7AC8C6E87CE82AB7166"},"decision":"accepted","decision_at_utc":"2026-09-19T08:37:50.204017Z","evidence":[{"bytes":13451,"path":"outputs/40-html-candidate/evidence/production_html_report.json","sha256":"FB2B75C17205E704C801B629886597D4093DE5E0E9E5FF933554E85E260C11B2"},{"bytes":14971,"path":"outputs/40-html-candidate/evidence/html_adapter_receipt.json","sha256":"C4D6C2BE1407E588D6A73B723298E6A6DE549BA542246BA5D09144574207D7FB"}],"producer_stage":{"bytes":7658,"path":"evidence/stages/40-html-candidate.manifest.json","sha256":"AC12B5F058F778AB0916853DE5C198B76A699F6BAA753C2723119AA2C7213545"},"receipt_sha256":"A10D7178A94EC73CA04B8A60D8EDA0EF76EEE1F42512F154385E62D835F3FEC2","recorder_role":"main_orchestrator","scenario_id":"number-7-dream","schema":"kb_creator.artifact_acceptance.v1","user_decision_reference":"2026-09-19 user explicitly accepted run25 HTML in task: ок принят хтмл; exact SHA-256 774F22BC2D1FF55BBCEF22ED5BC8539508F265A01D34E7AC8C6E87CE82AB7166"}
