{"artifact_kind":"artview","candidate":{"bytes":45740,"path":"outputs/30-artview-bundle/artifacts/candidate_manifest.json","sha256":"FC7CD2F0A58C0C5E372A1C9A4C05D110D7E2898939F3258BE9163454FD08FD00"},"decision":"accepted","decision_at_utc":"2026-09-19T08:30:01.076493Z","evidence":[{"bytes":331,"path":"outputs/30-artview-bundle/evidence/artview.qa.json","sha256":"79501662FBDB307151A6B0D062F119FB1FCB73C100F4DC3BCE463CA99A575722"},{"bytes":8304,"path":"submissions/artview/artview-decisions.accepted.json","sha256":"6EE7217A9B995EC3143A022ED6D6D3360CD19F3AB44C7A8169CE6222DA875BED"}],"producer_stage":{"bytes":24067,"path":"evidence/stages/30-artview-bundle.manifest.json","sha256":"2E35B05C3E750C81648E2A55CB1FB8F7BF177CCF3C3B8A422F865ED7EB884AF6"},"receipt_sha256":"FCF4512D0E59B870C60E1C615623EF0151E6B4631497D90ADBCD2D1AB97E0D3D","recorder_role":"main_orchestrator","scenario_id":"number-7-dream","schema":"kb_creator.artifact_acceptance.v1","user_decision_reference":"User updated number-7-dream.artview-decisions.accepted.json and explicitly directed continuation on 2026-09-19; run25 accepted export SHA-256 6EE7217A9B995EC3143A022ED6D6D3360CD19F3AB44C7A8169CE6222DA875BED; 20/20 reviewed and strict v4 validation passed"}
