{"artifact_kind":"master_ru","candidate":{"bytes":122946,"path":"outputs/21-master-ru-candidate/artifacts/MASTER_RU.md","sha256":"904133D5057172C404D28F3BCF2A5E4C578304A59382512D1B31FC56AE0FDAB2"},"decision":"accepted","decision_at_utc":"2026-09-19T10:38:09.631342Z","evidence":[{"bytes":460,"path":"outputs/21-master-ru-candidate/evidence/MASTER_RU.qa.json","sha256":"6E2C9959DA9A47FEEB46B180CA2F4274D58D1A72036701C4B2D607366A346105"},{"bytes":1535,"path":"outputs/21-master-ru-candidate/evidence/MASTER_RU.verification.json","sha256":"45926E59E73764A631AF180B107C937D73210289EF78D5A6FFAF983A5940DF75"}],"producer_stage":{"bytes":7277,"path":"evidence/stages/21-master-ru-candidate.manifest.json","sha256":"4D1DD2C2F5375DD9FCBD7662FC34720E099EE13EB7498339D11E567F73178957"},"receipt_sha256":"32118F038FEFD3C1A2DACA876F8D3C3C8975D2D4482F9AFAC6C4F7B140A6FE7E","recorder_role":"main_orchestrator","scenario_id":"number-7-dream","schema":"kb_creator.artifact_acceptance.v1","user_decision_reference":"Previously accepted MASTER_RU; run30 exact SHA-256 904133D5057172C404D28F3BCF2A5E4C578304A59382512D1B31FC56AE0FDAB2 unchanged"}
