{"artifact_kind":"artview","candidate":{"bytes":43664,"path":"outputs/30-artview-bundle/artifacts/candidate_manifest.json","sha256":"8D92D736C3C7D7E508E3FE9767D51CC1B435BDD70E42E0E873B4224B43CC7AF8"},"decision":"accepted","decision_at_utc":"2026-09-18T01:28:29.194625Z","evidence":[{"bytes":639,"path":"outputs/30-artview-bundle/evidence/artview.qa.json","sha256":"2AAD8F1B117DF72CB3A785F5F555BF9FA3E150D9F0CEB320BDD1B08A8C999D35"},{"bytes":7057,"path":"submissions/artview/artview-decisions.accepted.json","sha256":"6A1326CABEE791FA321E0D2D2651CB1C7BAE9E716D90EB6D492EF54333649F24"}],"producer_stage":{"bytes":20401,"path":"evidence/stages/30-artview-bundle.manifest.json","sha256":"A060BDFAB7B3DF6CBC332BC109D3535B2C0769A992A3697109488E875C57D774"},"receipt_sha256":"F27DC9CE59AD84EE8D0B7135AA2F9E9944E0A1154E4B3725DEC47B11C2AFF647","recorder_role":"main_orchestrator","scenario_id":"number-7-dream","schema":"kb_creator.artifact_acceptance.v1","user_decision_reference":"2026-09-18 user exported accepted JSON and said 'можешь продолжать'"}
