{"artifact_kind":"artview","candidate":{"bytes":45740,"path":"outputs/30-artview-bundle/artifacts/candidate_manifest.json","sha256":"A1045CBD368B57D4766F1E978E0315E78D33F37859119369AA0B69909BAD04C1"},"decision":"accepted","decision_at_utc":"2026-09-19T10:39:32.074666Z","evidence":[{"bytes":331,"path":"outputs/30-artview-bundle/evidence/artview.qa.json","sha256":"1B66236F250197C92B49E8C9F8F87F86D5FE44AF36EE287CD9B7BB9778DD74BE"},{"bytes":8304,"path":"submissions/artview/artview-decisions.accepted.json","sha256":"BD4EED5B94854FB8909512F1955ECE822CB5F523B990DEF107B90A2BBEF38933"}],"producer_stage":{"bytes":23931,"path":"evidence/stages/30-artview-bundle.manifest.json","sha256":"ED6D497E189E5C71BBFEC058EAAFDAC353D345065BF5CCD18E23A54F83536571"},"receipt_sha256":"2DF41A6A63208F702D13C3CD0C9F8637971A16B388A9EC28D41CB98B4A594132","recorder_role":"main_orchestrator","scenario_id":"number-7-dream","schema":"kb_creator.artifact_acceptance.v1","user_decision_reference":"Strict rebind of previously user-accepted run29 ArtView choices; 20/20 equivalent reviewed decisions and binaries"}
