{"artifact_kind":"docx","candidate":{"bytes":5349133,"path":"outputs/50-docx-candidate/artifacts/Number_7_Dream_RU.docx","sha256":"C29A5569820A3D2734F28089619F1BC273E1013A8CD040439C3F58899CE9F5BE"},"decision":"accepted","decision_at_utc":"2026-09-19T10:10:18.821881Z","evidence":[{"bytes":689,"path":"outputs/50-docx-candidate/evidence/docx_build.json","sha256":"75B19B403DB8C32727219813744009BD55D92C2B42F915439A35E68186C31116"},{"bytes":8116,"path":"outputs/50-docx-candidate/evidence/docx_render/render_inventory.json","sha256":"09092253E3FDAA07B61B2200CB5CAADCBF704527A9A0AB907DF10FBF7B55B3F1"}],"producer_stage":{"bytes":7676,"path":"evidence/stages/50-docx-candidate.manifest.json","sha256":"D604F14FC90575DA2B6E57C63F719E41DA4B70DA043A93AED93967C8EB6259AD"},"receipt_sha256":"D2192EA5C2BE9D4B7BDD58CB0CF247B0BE4F8B624C41D63BDD469723F908A9BA","recorder_role":"main_orchestrator","scenario_id":"number-7-dream","schema":"kb_creator.artifact_acceptance.v1","user_decision_reference":"2026-09-19 user edited run27 DOCX and directed continuation; exact reviewed source SHA-256 C29A5569820A3D2734F28089619F1BC273E1013A8CD040439C3F58899CE9F5BE, imported byte-identically into run28 Stage50"}
