{"artifact_kind":"artview","candidate":{"bytes":45740,"path":"outputs/30-artview-bundle/artifacts/candidate_manifest.json","sha256":"F33B08B2C7B621B7607381BD36B430430E2C2AC00B24F2D77A650473C4E26CF6"},"decision":"accepted","decision_at_utc":"2026-09-18T18:09:10.109228Z","evidence":[{"bytes":331,"path":"outputs/30-artview-bundle/evidence/artview.qa.json","sha256":"7C777BB0F9EE1BD7EA166101BCF172572A8A2B21FEF7CAA14E4681AA0CF30D98"},{"bytes":8304,"path":"submissions/artview/artview-decisions.accepted.json","sha256":"8504FE1DF206A25FA30B7EEAE90F0ED6FFFD6CF0F7A8408BE5146C19D86F07B0"}],"producer_stage":{"bytes":24066,"path":"evidence/stages/30-artview-bundle.manifest.json","sha256":"1311427D1E21C88C1BBAD930509AFA81B7F5FE54897FA60407531A836BFAE9B9"},"receipt_sha256":"D7B27CB7E7934D0B81BF439695D2C449EF82C09310EF882CBEDFD9DAE57EE922","recorder_role":"main_orchestrator","scenario_id":"number-7-dream","schema":"kb_creator.artifact_acceptance.v1","user_decision_reference":"User completed and exported number-7-dream.artview-decisions.accepted.json; exact run18 v4 document validates accepted with 20/20 reviewed and zero unresolved decisions"}
