{"artifact_kind":"docx","candidate":{"bytes":5350241,"path":"outputs/50-docx-candidate/artifacts/Number_7_Dream_RU.docx","sha256":"16ED29E537C6E87553A5BA4E8CB47725B96C2AE43E5F4ECA3E078716950970D5"},"decision":"accepted","decision_at_utc":"2026-09-19T10:42:09.964055Z","evidence":[{"bytes":689,"path":"outputs/50-docx-candidate/evidence/docx_build.json","sha256":"95F10368A91524A65B1E1C72A36433CC71EC1F5135D9FD3F3419D83D10114FB2"},{"bytes":8116,"path":"outputs/50-docx-candidate/evidence/docx_render/render_inventory.json","sha256":"8C62CE97F3E353B7AA51221BCD006A854845BCBAAA4EC1CB15BE6112372D27EB"}],"producer_stage":{"bytes":7676,"path":"evidence/stages/50-docx-candidate.manifest.json","sha256":"D008B4A47CC5E70293863210F18516E702606FB270BAAD51EAC950CEDDC310AB"},"receipt_sha256":"198B5D6A3FF8FFBDCF004883CC5DCB785635E6BDEF286CF677F9576AAEA9BC01","recorder_role":"main_orchestrator","scenario_id":"number-7-dream","schema":"kb_creator.artifact_acceptance.v1","user_decision_reference":"Identical reviewed DOCX SHA-256 16ED29E537C6E87553A5BA4E8CB47725B96C2AE43E5F4ECA3E078716950970D5, explicitly used for user-accepted run29 PDF; all 30 renders identical"}
