{"artifact_kind":"pdf","candidate":{"bytes":2914792,"path":"outputs/60-pdf-candidate/artifacts/Number_7_Dream_RU.pdf","sha256":"B39214DD4CCD084A0867697F883E7B08CEEBAD6EF3B66D5CC5EB04C41D399EBD"},"decision":"accepted","decision_at_utc":"2026-09-19T10:28:33.060469Z","evidence":[{"bytes":1167,"path":"outputs/60-pdf-candidate/evidence/docx_pdf_export.json","sha256":"09D9E62816AAF8D76DC79932AFACEBE8D10F714CF7D13F9D513568894FBD0467"},{"bytes":8231,"path":"outputs/60-pdf-candidate/evidence/final_render/render_inventory.json","sha256":"8E40537437541546D9D17F476C346112AF12670F31358AE91BBCE6B917772F42"}],"producer_stage":{"bytes":7610,"path":"evidence/stages/60-pdf-candidate.manifest.json","sha256":"300B2EDA0A8CEC5AE9EAABF0402D6C8F50EED55D52E56F1D6D88E52FD4E90F3D"},"receipt_sha256":"D6D274E21C752CC738B8D1D4BAF50C816BF4A5CD6A1223E07F42273035DE3205","recorder_role":"main_orchestrator","scenario_id":"number-7-dream","schema":"kb_creator.artifact_acceptance.v1","user_decision_reference":"2026-09-19 user explicitly accepted run29 PDF candidate; exact SHA-256 B39214DD4CCD084A0867697F883E7B08CEEBAD6EF3B66D5CC5EB04C41D399EBD"}
