{"artifact_kind":"html","candidate":{"bytes":153683,"path":"outputs/40-html-candidate/artifacts/Number_7_Dream_RU.html","sha256":"774F22BC2D1FF55BBCEF22ED5BC8539508F265A01D34E7AC8C6E87CE82AB7166"},"decision":"accepted","decision_at_utc":"2026-09-19T10:40:26.159585Z","evidence":[{"bytes":13451,"path":"outputs/40-html-candidate/evidence/production_html_report.json","sha256":"2B7780BEA10DFA0BAB9684EB8E2A1DFD9AB2F6A03CD964D374DEB8B3DF7BEB70"},{"bytes":14971,"path":"outputs/40-html-candidate/evidence/html_adapter_receipt.json","sha256":"0CDFE9635CE964B0FD5C82CAA6A879B0BC88E62345F9F70152A4BE6577AAA603"}],"producer_stage":{"bytes":7522,"path":"evidence/stages/40-html-candidate.manifest.json","sha256":"A0353B5340A3DD06F089C7C55331FEA1707671013648F60C9217D9E8D56A55C5"},"receipt_sha256":"BC6519649516A7E4F78D8DA7E40B572250C67A9781A1BEAA90FCBC5F9B1225E6","recorder_role":"main_orchestrator","scenario_id":"number-7-dream","schema":"kb_creator.artifact_acceptance.v1","user_decision_reference":"Previously user-accepted HTML SHA-256 774F22BC2D1FF55BBCEF22ED5BC8539508F265A01D34E7AC8C6E87CE82AB7166; run30 HTML and all 20 assets byte-identical"}
